,0
"Since the last time you filled out this form, how many hours have you worked with someone about this course? This include studying, working on assignments, being in studio.",1.394578313253012
"Since the last time you filled out this form, how many hours have you spent on assignments for this course?",2.0102409638554217
"Help:  As of right now, I have enough opportunities to get help from TAs/Instructors/my peers.",2.3012048192771086
"Since the last time you filled out this form, how many hours have you spent on reading, watching videos, and taking quizzes for this course?",1.3590361445783132
"Speed:  As of right now, the rate of new material is...",1.8433734939759037
"Understanding :  As of right now, I'm understanding what we are doing now (and recently)",2.3373493975903616
